{
  "$schema": "https://json-schema.org/draft/2020-12/schema",
  "$id": "https://medici-finance.github.io/assay/schemas/portfolio-measurement-v1.json",
  "title": "portfolio-measurement-v1",
  "description": "One allocation policy revision and the agent/human measurements reported for its scope and window (spec/portfolio-measurement-v1.md). Shape only: bucket exclusivity, source coverage, unit/quantity pairing, basis-point ceilings, interval order and dedupe/reconciliation are checked by statusgen/portfolio.",
  "type": "object",
  "properties": {
    "schema": {
      "const": "portfolio-measurement/v1"
    },
    "policy": {
      "type": "object",
      "properties": {
        "id": {
          "type": "string",
          "pattern": "^[A-Za-z0-9][A-Za-z0-9._:@/+-]{0,127}$"
        },
        "revision": {
          "type": "string",
          "pattern": "^[A-Za-z0-9][A-Za-z0-9._:@/+-]{0,127}$"
        },
        "scope": {
          "type": "string",
          "pattern": "^[a-z0-9][a-z0-9._-]*/[a-z0-9][a-z0-9._-]*$"
        },
        "window": {
          "type": "object",
          "description": "Half-open UTC interval in whole seconds; end must follow start (decoder-checked).",
          "properties": {
            "start": {
              "type": "string",
              "pattern": "^[0-9]{4}-[0-9]{2}-[0-9]{2}T[0-9]{2}:[0-9]{2}:[0-9]{2}Z$"
            },
            "end": {
              "type": "string",
              "pattern": "^[0-9]{4}-[0-9]{2}-[0-9]{2}T[0-9]{2}:[0-9]{2}:[0-9]{2}Z$"
            }
          },
          "required": [
            "start",
            "end"
          ],
          "additionalProperties": false
        },
        "sources": {
          "type": "array",
          "minItems": 1,
          "items": {
            "type": "string",
            "pattern": "^[A-Za-z0-9][A-Za-z0-9._:@/+-]{0,127}$"
          }
        },
        "weights": {
          "type": "object",
          "description": "Explicit per-model weight table in thousandths; an unlisted model has an unknown weight.",
          "properties": {
            "id": {
              "type": "string",
              "pattern": "^[A-Za-z0-9][A-Za-z0-9._:@/+-]{0,127}$"
            },
            "revision": {
              "type": "string",
              "pattern": "^[A-Za-z0-9][A-Za-z0-9._:@/+-]{0,127}$"
            },
            "models": {
              "type": "array",
              "items": {
                "type": "object",
                "properties": {
                  "model": {
                    "type": "string",
                    "pattern": "^[A-Za-z0-9][A-Za-z0-9._:@/+-]{0,127}$"
                  },
                  "milli": {
                    "type": "integer",
                    "minimum": 0
                  }
                },
                "required": [
                  "model",
                  "milli"
                ],
                "additionalProperties": false
              }
            }
          },
          "required": [
            "id",
            "revision",
            "models"
          ],
          "additionalProperties": false
        },
        "tolerance-basis-points": {
          "type": "integer",
          "minimum": 0
        },
        "buckets": {
          "type": "array",
          "minItems": 1,
          "items": {
            "type": "object",
            "properties": {
              "id": {
                "type": "string",
                "pattern": "^[A-Za-z0-9][A-Za-z0-9._:@/+-]{0,127}$"
              },
              "members": {
                "type": "array",
                "minItems": 1,
                "items": {
                  "type": "object",
                  "description": "Repository-qualified REQ reference.",
                  "properties": {
                    "repository": {
                      "type": "string",
                      "pattern": "^[a-z0-9][a-z0-9._-]*/[a-z0-9][a-z0-9._-]*$"
                    },
                    "requirement": {
                      "type": "string",
                      "pattern": "^REQ-[a-z0-9][a-z0-9-]{8,18}[a-z0-9]$"
                    }
                  },
                  "required": [
                    "repository",
                    "requirement"
                  ],
                  "additionalProperties": false
                }
              },
              "agent-target": {
                "type": "object",
                "properties": {
                  "measure": {
                    "type": "string",
                    "enum": [
                      "active-seconds",
                      "weighted-active-milliseconds",
                      "cost-micros"
                    ]
                  },
                  "basis-points": {
                    "type": "integer",
                    "minimum": 0
                  }
                },
                "required": [
                  "measure",
                  "basis-points"
                ],
                "additionalProperties": false
              },
              "human-target": {
                "type": "object",
                "properties": {
                  "measure": {
                    "type": "string",
                    "enum": [
                      "decisions",
                      "decision-minutes"
                    ]
                  },
                  "basis-points": {
                    "type": "integer",
                    "minimum": 0
                  }
                },
                "required": [
                  "measure",
                  "basis-points"
                ],
                "additionalProperties": false
              }
            },
            "required": [
              "id",
              "members",
              "agent-target",
              "human-target"
            ],
            "additionalProperties": false
          }
        },
        "limits": {
          "type": "array",
          "items": {
            "type": "object",
            "properties": {
              "bucket": {
                "type": "string",
                "pattern": "^[A-Za-z0-9][A-Za-z0-9._:@/+-]{0,127}$"
              },
              "measure": {
                "type": "string",
                "enum": [
                  "active-seconds",
                  "weighted-active-milliseconds",
                  "cost-micros",
                  "decisions",
                  "decision-minutes"
                ]
              },
              "max": {
                "type": "integer",
                "minimum": 0
              },
              "authorization": {
                "type": "string",
                "pattern": "^[A-Za-z0-9][A-Za-z0-9._:@/+-]{0,127}$"
              }
            },
            "required": [
              "bucket",
              "measure",
              "max",
              "authorization"
            ],
            "additionalProperties": false
          }
        }
      },
      "required": [
        "id",
        "revision",
        "scope",
        "window",
        "sources",
        "weights",
        "tolerance-basis-points",
        "buckets"
      ],
      "additionalProperties": false
    },
    "segments": {
      "type": "array",
      "items": {
        "type": "object",
        "properties": {
          "invocation": {
            "type": "object",
            "properties": {
              "caller": {
                "type": "string",
                "pattern": "^[A-Za-z0-9][A-Za-z0-9._:@/+-]{0,127}$"
              },
              "id": {
                "type": "string",
                "pattern": "^[A-Za-z0-9][A-Za-z0-9._:@/+-]{0,127}$"
              }
            },
            "required": [
              "caller",
              "id"
            ],
            "additionalProperties": false
          },
          "id": {
            "type": "string",
            "pattern": "^[A-Za-z0-9][A-Za-z0-9._:@/+-]{0,127}$"
          },
          "revision": {
            "type": "string",
            "pattern": "^[A-Za-z0-9][A-Za-z0-9._:@/+-]{0,127}$"
          },
          "profile": {
            "type": "object",
            "properties": {
              "id": {
                "type": "string",
                "pattern": "^[A-Za-z0-9][A-Za-z0-9._:@/+-]{0,127}$"
              },
              "revision": {
                "type": "string",
                "pattern": "^[A-Za-z0-9][A-Za-z0-9._:@/+-]{0,127}$"
              },
              "model": {
                "type": "string",
                "pattern": "^[A-Za-z0-9][A-Za-z0-9._:@/+-]{0,127}$"
              }
            },
            "required": [
              "id",
              "revision",
              "model"
            ],
            "additionalProperties": false
          },
          "actual-model": {
            "type": "string",
            "pattern": "^[A-Za-z0-9][A-Za-z0-9._:@/+-]{0,127}$"
          },
          "source": {
            "type": "string",
            "pattern": "^[A-Za-z0-9][A-Za-z0-9._:@/+-]{0,127}$"
          },
          "subject": {
            "type": "object",
            "description": "Repository-qualified REQ reference.",
            "properties": {
              "repository": {
                "type": "string",
                "pattern": "^[a-z0-9][a-z0-9._-]*/[a-z0-9][a-z0-9._-]*$"
              },
              "requirement": {
                "type": "string",
                "pattern": "^REQ-[a-z0-9][a-z0-9-]{8,18}[a-z0-9]$"
              }
            },
            "required": [
              "repository",
              "requirement"
            ],
            "additionalProperties": false
          },
          "active": {
            "type": "object",
            "description": "Half-open UTC interval in whole seconds; end must follow start (decoder-checked).",
            "properties": {
              "start": {
                "type": "string",
                "pattern": "^[0-9]{4}-[0-9]{2}-[0-9]{2}T[0-9]{2}:[0-9]{2}:[0-9]{2}Z$"
              },
              "end": {
                "type": "string",
                "pattern": "^[0-9]{4}-[0-9]{2}-[0-9]{2}T[0-9]{2}:[0-9]{2}:[0-9]{2}Z$"
              }
            },
            "required": [
              "start",
              "end"
            ],
            "additionalProperties": false
          },
          "elapsed-seconds-proxy": {
            "type": "integer",
            "minimum": 0
          },
          "cost-micros": {
            "type": "integer",
            "minimum": 0
          }
        },
        "required": [
          "invocation",
          "id",
          "revision",
          "profile",
          "source"
        ],
        "additionalProperties": false
      }
    },
    "decisions": {
      "type": "array",
      "items": {
        "type": "object",
        "properties": {
          "id": {
            "type": "string",
            "pattern": "^[A-Za-z0-9][A-Za-z0-9._:@/+-]{0,127}$"
          },
          "unit": {
            "type": "string",
            "enum": [
              "decision",
              "minute"
            ]
          },
          "quantity": {
            "type": "integer",
            "minimum": 1
          },
          "window": {
            "type": "object",
            "description": "Half-open UTC interval in whole seconds; end must follow start (decoder-checked).",
            "properties": {
              "start": {
                "type": "string",
                "pattern": "^[0-9]{4}-[0-9]{2}-[0-9]{2}T[0-9]{2}:[0-9]{2}:[0-9]{2}Z$"
              },
              "end": {
                "type": "string",
                "pattern": "^[0-9]{4}-[0-9]{2}-[0-9]{2}T[0-9]{2}:[0-9]{2}:[0-9]{2}Z$"
              }
            },
            "required": [
              "start",
              "end"
            ],
            "additionalProperties": false
          },
          "primary-subject": {
            "type": "object",
            "description": "Repository-qualified REQ reference.",
            "properties": {
              "repository": {
                "type": "string",
                "pattern": "^[a-z0-9][a-z0-9._-]*/[a-z0-9][a-z0-9._-]*$"
              },
              "requirement": {
                "type": "string",
                "pattern": "^REQ-[a-z0-9][a-z0-9-]{8,18}[a-z0-9]$"
              }
            },
            "required": [
              "repository",
              "requirement"
            ],
            "additionalProperties": false
          },
          "source": {
            "type": "string",
            "pattern": "^[A-Za-z0-9][A-Za-z0-9._:@/+-]{0,127}$"
          }
        },
        "required": [
          "id",
          "unit",
          "window",
          "source"
        ],
        "additionalProperties": false
      }
    },
    "reconciliations": {
      "type": "array",
      "items": {
        "type": "object",
        "properties": {
          "invocation": {
            "type": "object",
            "properties": {
              "caller": {
                "type": "string",
                "pattern": "^[A-Za-z0-9][A-Za-z0-9._:@/+-]{0,127}$"
              },
              "id": {
                "type": "string",
                "pattern": "^[A-Za-z0-9][A-Za-z0-9._:@/+-]{0,127}$"
              }
            },
            "required": [
              "caller",
              "id"
            ],
            "additionalProperties": false
          },
          "accept": {
            "type": "array",
            "minItems": 1,
            "items": {
              "type": "object",
              "properties": {
                "id": {
                  "type": "string",
                  "pattern": "^[A-Za-z0-9][A-Za-z0-9._:@/+-]{0,127}$"
                },
                "revision": {
                  "type": "string",
                  "pattern": "^[A-Za-z0-9][A-Za-z0-9._:@/+-]{0,127}$"
                }
              },
              "required": [
                "id",
                "revision"
              ],
              "additionalProperties": false
            }
          },
          "reason": {
            "type": "string",
            "pattern": "[^ \\t\\r\\n]"
          },
          "source": {
            "type": "string",
            "pattern": "^[A-Za-z0-9][A-Za-z0-9._:@/+-]{0,127}$"
          }
        },
        "required": [
          "invocation",
          "accept",
          "reason",
          "source"
        ],
        "additionalProperties": false
      }
    }
  },
  "required": [
    "schema",
    "policy",
    "segments",
    "decisions"
  ],
  "additionalProperties": false
}
